{
  "identifier": "sample_content",
  "extract": {
    "type": "\\Drupal\\dkan_harvest\\ETL\\Extract\\DataJson",
    "uri": "/dkan_sample_content.json"
  },
  "transforms": ["\\Drupal\\dkan_harvest\\Transform\\ResourceImporter"],
  "load": {
    "type": "\\Drupal\\dkan_harvest\\Load\\Dataset"
  }
}
